{
  "version": 1,
  "created_at": "2026-08-25T00:00:00+00:00",
  "mode": "balanced",
  "input_path": "/tmp/reduce_sum.py",
  "input_sha256": "0123456789abcdef0123456789abcdef0123456789abcdef0123456789abcdef",
  "manual_review_required": false,
  "manual_review_reason": null,
  "limits": {
    "max_wall_time_sec": 1800,
    "max_subagent_calls": 8,
    "max_worker_calls": 8,
    "max_strategy_attempts": 8,
    "max_advanced_iterations": 0,
    "advanced_patience": 0,
    "min_improvement_pct": 2.0
  },
  "signals": {
    "has_triton_kernel": true,
    "has_kernel_launch": true,
    "has_reduction": true,
    "block_params": ["BLOCK_M"]
  },
  "oob_strategies": [
    {"order": 1, "name": "retiling", "selected": true, "reason": "reduction detected"},
    {"order": 2, "name": "reduce-opt", "selected": true, "reason": "reduction detected"}
  ],
  "selected_oob_strategies": ["retiling", "reduce-opt"],
  "advanced": {
    "enabled": false,
    "reason": "balanced mode does not run advanced optimization",
    "candidates": []
  }
}
